{
  "case_id": "CLI-XMLLINT-0006",
  "surface": "cli-xmllint",
  "purpose": "--valid on invalid doc (exit 3 epoch)",
  "oracle_profile": "libxml2-2.15.3",
  "inputs": {
    "argv": [
      "invalid.xml",
      "--valid"
    ],
    "document": "invalid.xml"
  },
  "observables": [
    "exit_status",
    "stdout_hash",
    "stderr_hash"
  ],
  "normalization": [],
  "provenance": [
    "upstream-documentation",
    "phase-10-differential-corpus"
  ],
  "tags": [
    "differential",
    "xmllint"
  ]
}
