{
  "case_id": "CLI-XMLLINT-0047",
  "surface": "cli-xmllint",
  "purpose": "relative namespace URI rejection in exclusive C14N (R-000166)",
  "oracle_profile": "libxml2-2.15.3",
  "inputs": {
    "argv": [
      "c14n-rel.xml",
      "--exc-c14n"
    ],
    "document": "c14n-rel.xml"
  },
  "observables": [
    "exit_status",
    "stdout_hash",
    "stderr_hash"
  ],
  "normalization": [],
  "provenance": [
    "residual-R-000166",
    "differential"
  ],
  "tags": [
    "differential",
    "xmllint"
  ]
}
