{
  "case_id": "CLI-XMLLINT-0043",
  "surface": "cli-xmllint",
  "purpose": "C14N 1.0 inclusive: ns propagation, rebinding chains, xml:lang (R-000166)",
  "oracle_profile": "libxml2-2.15.3",
  "inputs": {
    "argv": [
      "c14n-ns.xml",
      "--c14n"
    ],
    "document": "c14n-ns.xml"
  },
  "observables": [
    "exit_status",
    "stdout_hash",
    "stderr_hash"
  ],
  "normalization": [],
  "provenance": [
    "residual-R-000166",
    "differential"
  ],
  "tags": [
    "differential",
    "xmllint"
  ]
}
