{
  "case_id": "CLI-XMLLINT-0001",
  "surface": "cli-xmllint",
  "purpose": "plain parse + dump",
  "oracle_profile": "libxml2-2.15.3",
  "inputs": {
    "argv": [
      "ok.xml"
    ],
    "document": "ok.xml"
  },
  "observables": [
    "exit_status",
    "stdout_hash",
    "stderr_hash"
  ],
  "normalization": [],
  "provenance": [
    "upstream-documentation",
    "phase-10-differential-corpus"
  ],
  "tags": [
    "differential",
    "xmllint"
  ]
}
