{
  "case_id": "CLI-XMLLINT-0012",
  "surface": "cli-xmllint",
  "purpose": "--xpath attribute node-set",
  "oracle_profile": "libxml2-2.15.3",
  "inputs": {
    "argv": [
      "lib.xml",
      "--xpath",
      "@id"
    ],
    "document": "lib.xml"
  },
  "observables": [
    "exit_status",
    "stdout_hash",
    "stderr_hash"
  ],
  "normalization": [],
  "provenance": [
    "upstream-documentation",
    "phase-10-differential-corpus"
  ],
  "tags": [
    "differential",
    "xmllint"
  ]
}
